[{"aperture_fnumber":5.679,"camera_make":"Canon","camera_model":"EOS R5","capture_datetime_utc":"2024-06-30T12:34:56Z","exposure_compensation_ev":-0.333,"extraction_warnings":[],"extractor":{"config_fingerprint_sha256":"76f8c19d4fbf41d9a40a4f9fd30aa0859a2092a7c64e1eaed345c8eb5d604838","name":"extract_capture_metadata.py","version":"phase4c-v1"},"file_sha256":"cbae4891adc2a2e65ce3031d360d5f1f9b87b6ae40f82973eaa7bef7980bf806","focal_length_mm":24.988,"gps_latitude":34.12345679,"gps_longitude":-118.98765432,"lens_model":"RF24-70mm F2.8 L IS USM","metadata_contract_version":"tp.meta.capture.v1","orientation":"Rotate90CW","relative_path":"sample_01.dng","shutter_speed_seconds":0.008333}]
